{
  "$schema":"https://json-schema.org/draft/2020-12/schema","type":"object","required":["part_id","condition","family","reference_frame","required_substructures","substructures","connectivity_rules","symmetry_rules","open_space_rules","allowed_cad_strategies","invalid_configurations","construction_sequence","final_objects","editable_parameter"],
  "properties":{"part_id":{"enum":["R02_P04","R02_P06"]},"condition":{"enum":["B1","B2"]},"family":{"enum":["stepped_housing","compound_profile_housing","explicit_gripper_substructure","articulated_plate_gripper"]},"reference_frame":{"type":"object","required":["origin","x_axis","y_axis","z_axis"]},"required_substructures":{"type":"array","minItems":5,"items":{"type":"string"},"uniqueItems":true},"substructures":{"type":"array","minItems":5,"items":{"type":"object","required":["substructure_id","semantic_role","parent","reference_frame","approximate_bbox","orientation","shape_family","symmetry_relation","connection_relation","gap_relation","pivot_relation","cad_strategy","parameters","feature_ref"],"properties":{"substructure_id":{"type":"string"},"semantic_role":{"type":"string"},"parent":{"type":["string","null"]},"reference_frame":{"type":"string"},"approximate_bbox":{"type":"array","items":{"type":"number"},"minItems":3,"maxItems":3},"orientation":{"type":"array","items":{"type":"number"},"minItems":3,"maxItems":3},"shape_family":{"type":"string"},"symmetry_relation":{"type":["string","null"]},"connection_relation":{"type":"array","items":{"type":"string"}},"gap_relation":{"type":["string","null"]},"pivot_relation":{"type":["string","null"]},"cad_strategy":{"enum":["POLYGON_EXTRUDE","MULTI_PROFILE_LOFT","REVOLVED_OR_CYLINDRICAL_BOSS","BOOLEAN_CUT","ORIENTED_PRISM","PROFILE_LINK","MIRRORED_PAIR"]},"parameters":{"type":"object","minProperties":2},"feature_ref":{"type":"string"}},"additionalProperties":false}},"connectivity_rules":{"type":"array","minItems":1},"symmetry_rules":{"type":"array"},"open_space_rules":{"type":"array"},"allowed_cad_strategies":{"type":"array","minItems":1},"invalid_configurations":{"type":"array","minItems":1},"construction_sequence":{"type":"array","minItems":5,"items":{"type":"object"}},"final_objects":{"type":"array","minItems":1,"items":{"type":"string"}},"editable_parameter":{"type":"object","required":["object_id","property","baseline_value","edit_fraction"]}},"additionalProperties":false
}
